{"$id":"https://dji.com/schemas/fh2-plugin-contract/workflow.schema.json","$schema":"http://json-schema.org/draft-07/schema#","additionalProperties":false,"properties":{"description":{"type":"string"},"name":{"type":"string"},"steps":{"items":{"additionalProperties":false,"properties":{"action":{"anyOf":[{"enum":["dispatch_mission","query_flight_task","return_home","run_script","spawn_agent","update_event_status","wait_signal"],"type":"string"},{"pattern":"^plugin\\..+$","type":"string"}]},"await":{"additionalProperties":false,"properties":{"extraKeys":{"enum":["allow","reject"],"type":"string"},"interruptedBy":{"items":{"type":"string"},"type":"array"},"optional":{"oneOf":[{"items":{"type":"string"},"type":"array"},{"items":{"additionalProperties":false,"properties":{"key":{"type":"string"},"type":{"enum":["array","bool","number","object","string"],"type":"string"}},"required":["key"],"type":"object"},"type":"array"}]},"provides":{"oneOf":[{"items":{"type":"string"},"type":"array"},{"items":{"additionalProperties":false,"properties":{"key":{"type":"string"},"type":{"enum":["array","bool","number","object","string"],"type":"string"}},"required":["key"],"type":"object"},"type":"array"}]},"signal":{"type":"string"},"timeoutSec":{"type":"integer"},"timeoutSecFrom":{"type":"string"}},"required":["signal"],"type":"object"},"callback":{"additionalProperties":false,"properties":{"extraKeys":{"enum":["allow","reject"],"type":"string"},"interruptedBy":{"items":{"type":"string"},"type":"array"},"optional":{"oneOf":[{"items":{"type":"string"},"type":"array"},{"items":{"additionalProperties":false,"properties":{"key":{"type":"string"},"type":{"enum":["array","bool","number","object","string"],"type":"string"}},"required":["key"],"type":"object"},"type":"array"}]},"provides":{"oneOf":[{"items":{"type":"string"},"type":"array"},{"items":{"additionalProperties":false,"properties":{"key":{"type":"string"},"type":{"enum":["array","bool","number","object","string"],"type":"string"}},"required":["key"],"type":"object"},"type":"array"}]},"signal":{"type":"string"},"timeoutSec":{"type":"integer"},"timeoutSecFrom":{"type":"string"}},"required":["signal"],"type":"object"},"delaySec":{"type":"integer"},"description":{"type":"string"},"id":{"type":"string"},"inputs":{"additionalProperties":{"additionalProperties":false,"oneOf":[{"not":{"required":["const"]},"required":["from"]},{"not":{"required":["from"]},"required":["const"]}],"properties":{"const":{},"from":{"minLength":1,"type":"string"}},"type":"object"},"type":"object"},"maxAttempts":{"type":"integer"},"needs":{"items":{"type":"string"},"type":"array"},"timeoutSec":{"type":"integer"},"trigger":{"enum":["allDone","allSucceeded"],"type":"string"},"when":{"additionalProperties":false,"properties":{"and":{"items":{},"type":"array"},"field":{"type":"string"},"op":{"enum":["blank","eq","exists","in","ne","present"],"type":"string"},"or":{"items":{},"type":"array"},"value":{}},"required":[],"type":"object"}},"required":["action","id"],"type":"object"},"type":"array"},"trigger":{"additionalProperties":false,"anyOf":[{"required":["api"]},{"required":["bizNotify"]},{"required":["job"]},{"required":["schedule"]},{"required":["stream"]}],"properties":{"api":{"additionalProperties":false,"properties":{"description":{"type":"string"},"seed":{"items":{"type":"string"},"type":"array"}},"required":[],"type":"object"},"bizNotify":{"additionalProperties":false,"properties":{"description":{"type":"string"},"eventKind":{"type":"string"},"params":{"additionalProperties":{"additionalProperties":false,"properties":{"as":{"type":"string"},"max":{"type":"number"},"type":{"enum":["bool","number","string"],"type":"string"}},"required":[],"type":"object"},"type":"object"},"paused":{"type":"boolean"},"seed":{"items":{"type":"string"},"type":"array"},"subscriber":{"minLength":1,"type":"string"}},"required":["seed","subscriber"],"type":"object"},"description":{"type":"string"},"job":{"additionalProperties":false,"properties":{"description":{"type":"string"},"seed":{"items":{"type":"string"},"type":"array"}},"required":[],"type":"object"},"schedule":{"additionalProperties":false,"properties":{"executionTimeoutSec":{"type":"integer"},"intervalSec":{"minimum":1,"type":"integer"},"paused":{"type":"boolean"}},"required":["intervalSec"],"type":"object"},"stream":{"additionalProperties":false,"properties":{"description":{"type":"string"},"match":{"additionalProperties":{"type":"string"},"minProperties":1,"propertyNames":{"enum":["event_id","event_type","flight_mission_id","notify_on","occurred_at","payload","priority","result_code","source","status","tenant_id"],"type":"string"},"type":"object"},"paused":{"type":"boolean"},"seed":{"items":{"enum":["eventId","eventType","flightMissionId","lat","lng","notifyOn","occurredAt","payload","priority","resultCode","source","status","tenantId"],"type":"string"},"type":"array"}},"required":["match","seed"],"type":"object"}},"required":[],"type":"object"}},"required":["name","steps","trigger"],"title":"FH2 Workflow definition","type":"object","x-conditionOperators":["blank","eq","exists","in","ne","present"],"x-platformActions":["dispatch_mission","query_flight_task","return_home","run_script","spawn_agent","update_event_status","wait_signal"],"x-pluginActionPattern":"plugin.<capabilityName>","x-triggerAxes":["api","bizNotify","job","schedule","stream"]}
